,0,1
179,On the tax rate. You talked about geography and obviously we've seen tax rates similar to that that you had this quarter in the past. Would it be appropriate for us to factor that in together with the norm – for the first quarter together with the normal kind of low- 30%s and be thinking in terms of something along the lines of 30% for the full y ear? Or would y ou expect this tax rate to continue?,"{'neg': 0.035, 'neu': 0.965, 'pos': 0.0, 'compound': -0.4124}"
180,"On FICC, FX and rates were very strong, but you obviously highlighted as did everybody else, credit and mortgages being weak year-over-year. But we had an environment where if you look at trace volumes being up, credit spreads were pretty stable. What's really hurting that business? Is it just simply there wasn't enough volatility or just absolute low rates are hurting spreads? Or is it, clearly inventory levels are down, or is it a combination of all those things. Just trying to think what is a better environment? Do we just need to see higher rates?Okay . So we just kind of need to wait to see. Rates get a more conviction around rates and predictability. ","{'neg': 0.103, 'neu': 0.721, 'pos': 0.175, 'compound': 0.8772}"
181,"On the banking cycle and M&A. Clearly, we've seen a nice pick up and continued in the first quarter. Where do you, in terms of, conversations with clients, do you still think there is a lot of juice left. Then I think if you look at past cycle, this would imply we still have quite a bit of room to go. Just  want to hear your thoughts on it if you...","{'neg': 0.0, 'neu': 0.904, 'pos': 0.096, 'compound': 0.7003}"
182,"On the equity client execution, because the result is so discontinuous with – it's roughly double the last, say, eight quarter moving average. Can you say it was just a unique opportunity set? Was it a couple of big transactions? Was it related to the block transactions that you were talking about earlier? Or is this more like the new normal?","{'neg': 0.045, 'neu': 0.853, 'pos': 0.102, 'compound': 0.5651}"
183,"On a global macro view, back in 2011, the prospect of a Greek default set the Eurozone in crisis and we seem closer to it than ever. Is it now, in your view, a non-event, if and when it happens, that everyone has had enough time and preparation to get ready for it?","{'neg': 0.073, 'neu': 0.842, 'pos': 0.084, 'compound': -0.1027}"
184,"On thinking about equities here coming into 2Q, typically strong given dividend season in Europe. How much do you think that QE on the continent is going to play into that this quarter?","{'neg': 0.0, 'neu': 0.845, 'pos': 0.155, 'compound': 0.6908}"
185,"Back to equities can you speak to what impact Asia had on the quarter, particularly given some of the market structure changes we saw in the region?","{'neg': 0.0, 'neu': 1.0, 'pos': 0.0, 'compound': 0.0}"
186,"On CCAR and your preferred issuance plans. With total capital under CCAR specifically now the binding constraint for the firm, even though you're already operating at that 150-basis point preferred target, is it fair to expect that you'll look to close the gap or improve your CCAR position by issuing more preferreds or more qualifying debt?","{'neg': 0.046, 'neu': 0.869, 'pos': 0.085, 'compound': 0.3446}"
187,"You mentioned about capital allocations under CCAR, it might be helpful if you could clarify regarding how you allocate the capital under your attributable equity framework? Under a CCAR lens, do you use your stressed end of period or your minimum ratio for determining the level of required capital for assessing the adequacy of the ROEs for various trades?","{'neg': 0.039, 'neu': 0.91, 'pos': 0.051, 'compound': 0.1926}"
188,"In terms of what's going on in the capital markets with your businesses, specifically on the energy side of things. We've heard from a number of more commercially -oriented banks so far this earnings season about what's going on with their borrowing and capital markets activity within that sector, specifically. I'm curious, given what's happened in the last two quarters to three quarters in the oil markets, have you seen a meaningful increase in those companies coming to market, or has that been much more status quo?","{'neg': 0.0, 'neu': 0.886, 'pos': 0.114, 'compound': 0.8074}"
189,"On Investment Management, you mentioned that there was an outflow on liquidity products that seemed a little bit larger than what we've seen from a couple of other peers. I guess I'm curious if you can just give us a little more color on that and does what's happened over the last couple of quarters with the flows presume a somewhat higher normalized pre-tax margin in that business relative to the high-teens that you typically put up?","{'neg': 0.0, 'neu': 0.969, 'pos': 0.031, 'compound': 0.3182}"
190,Was there any material change this quarter versus the fourth quarter in the benefit to y our Basel III ratios from the significant financial institution deduction that you said was about $5 billion last quarter?,"{'neg': 0.0, 'neu': 0.87, 'pos': 0.13, 'compound': 0.5859}"
191,On the capital ratios. Can you give us what the fully phased -in capital ratios are with the RWA?,"{'neg': 0.0, 'neu': 1.0, 'pos': 0.0, 'compound': 0.0}"
192,"For the SLR, now that you're at 5 .3% and the kind of the constraining ratio for CCAR has moved out to total capital, do you have a sense of what the buffer is that you would run the SLR at now? Could you get away with a 50-basis point buffer since total seems to be constraining?","{'neg': 0.0, 'neu': 1.0, 'pos': 0.0, 'compound': 0.0}"
193,"One of the dominant themes from Goldman last year was the very significant reduction in its balance sheet size, and so I'm wondering how – if we should be thinking about that differently at all at this stage given what you're talking about with respect to client interests and demands, but relative to the capital constraints that were highlighted under this year's CCAR, and I'm assuming were the genesis for today's preferred offering. How should we think about all those dynamics with respect to balance sheet size?It sounds like from your repricing commentary, you do see that at least on the margin occurring?","{'neg': 0.0, 'neu': 0.861, 'pos': 0.139, 'compound': 0.9261}"
194,"On the ROE outlook and the drivers, your margin is a big one, and the pre-tax margin for all of last year was 36%. It was 37% this quarter, which I thought was impressive. So when you just look at the businesses at more of a granular level, are there areas where you feel like you're getting to about as good as it will be? And then where do you see the biggest areas for additional leverage to the margin?","{'neg': 0.0, 'neu': 0.891, 'pos': 0.109, 'compound': 0.8426}"
195,"On Europe, the stability that's helping client activity, is there any way you can just help size that for us relative to the recent past? How much stronger was it this quarter? We talked about derivatives, but where else is that pick-up? And then any perspective around how much bigger it was this quarter relative to the recent past?","{'neg': 0.0, 'neu': 0.9, 'pos': 0.1, 'compound': 0.6381}"
196,"On equity derivatives, could you just give a little bit more flavor in terms of products, if the strength's on the execution side came maybe more from the flow side or was it more from the delta one side or structuring side or dividend swaps? Can you just talk a little bit through the products in order for us to get a better understanding of what we should think about going forward trends in some of these areas, because clearly some of them are bit more bulky than others, if I may.","{'neg': 0.0, 'neu': 0.939, 'pos': 0.061, 'compound': 0.6808}"
197,"And there's no real distinction between structuring versus flow in terms of your mix, not much has significantly changed?","{'neg': 0.109, 'neu': 0.891, 'pos': 0.0, 'compound': -0.296}"
198,"With respect to fixed income, we've had some things giving us a bit of a steer of how the revenues break down between macro and credit. And I was wondering could you give us a bit of a feeler as well? Is it half-half at this point in the first quarter? Or should we think about it differently?","{'neg': 0.0, 'neu': 0.82, 'pos': 0.18, 'compound': 0.867}"
199,"Commodities had an uptick in volatility, but at the same time, you highlight volatility as a business which year-on-year was down. I'm just wondering if you could just explain a l ittle bit to me why commodities was relatively weak on a year-on-year basis?","{'neg': 0.086, 'neu': 0.845, 'pos': 0.069, 'compound': -0.1901}"
200,"On the largest increase in five years in tangible book value. With the increasing returns and still some constraints on capital deployment, isn't that really a fundamental accelerator as you look forward over the next couple of y ears?","{'neg': 0.0, 'neu': 0.882, 'pos': 0.118, 'compound': 0.5719}"
201,"When you look at the comp ratio at 42%, which you made some improvement with what you've done in the past, but when you look at it on the average for the year, you've recently highlighted the 38% kind of number in that, you would look for the year being closer to what you'v e done in the past couple of years. When you say that you almost have $0.50,$0.60 of earnings per share that's basically pushed forward as you review performance  and your compensation plans over the rest of the year?","{'neg': 0.0, 'neu': 0.938, 'pos': 0.062, 'compound': 0.5873}"
202,"First question I guess is if you could give us a little bit more color on Fixed Income and Commodities, given that it seems like you had a pretty high hurdle to deal with Commodities, not only having done well in Q1 last year but also you having sold TransMontaigne. Can you give us a little bit more color on how you managed to see revenue there actually up year-on-year?And are you still looking to sell those storage and other physical businesses?","{'neg': 0.0, 'neu': 0.929, 'pos': 0.071, 'compound': 0.5803}"
203,And maybe a little bit of color on the reduction in the RWA in FIC in the quarter. Can you give us a sense for how much of that was from runoff of some of the legacy positions that you’ve talked about in the past that don’t generate revenue?,"{'neg': 0.0, 'neu': 1.0, 'pos': 0.0, 'compound': 0.0}"
204,"And then final question really on moves in the capital account. There’s a lot of moving parts it seems like this quarter. We know that, overall, capital was kind of flat, but we can see in the average allocations that you provide that you moved or retained more capital in the Institutional Securities business, and I was wondering if you could give us a little sense for, given the RWA movement, what’s going on there.So we shouldn’t necessarily expect that to remain in ISG as we move through the quarters of the year, or is there something to do with continued regulatory changes that would drive those capital levels a little bit higher?","{'neg': 0.0, 'neu': 0.949, 'pos': 0.051, 'compound': 0.5719}"
205,The first question for James. You have a 10% ROE target. You certainly achieved that in Q1. What is your timeframe to achieve the 10% ROE for the year?What is the 10.1% on a tangible basis?,"{'neg': 0.0, 'neu': 0.923, 'pos': 0.077, 'compound': 0.4137}"
206,"And then a separate question, your VaR stayed flat from Q4 when your VaR peers actually went up. What’s your thought process there? Did you leave money on the table? Is a that a lower risk profile? What’s going on?","{'neg': 0.16, 'neu': 0.84, 'pos': 0.0, 'compound': -0.6662}"
207,"And then lastly, Ruth, you’re yet one more banking executive to leave the industry. Any last comment about the regulation in the banking industry?","{'neg': 0.05, 'neu': 0.95, 'pos': 0.0, 'compound': -0.0516}"
208,"In your commentary on FIC about structured transactions being a contributor. I’m curious if that is only in Commodities or if that was in other parts of the business and how big of a driver. And more importantly, is that a sustainable appetite by clients? Because we’ve kind of all been waiting for that for a while.Okay. And does that mean – I don’t want to put words in your mouth, but was the Commodities contribution of the quarter larger than normal times just because some of the things you mentioned plus the weather?","{'neg': 0.0, 'neu': 0.945, 'pos': 0.055, 'compound': 0.4509}"
209,"And then the RWA down 4% for the firm sequentially, I think you said 6% in FIC. It’s good, it’s welcome. Is that not a number that we want to straight line, right?Can it fall at that pace on an annualized basis?","{'neg': 0.027, 'neu': 0.766, 'pos': 0.207, 'compound': 0.8041}"
210,"Share count was flat year-on-year, but you got a higher authorization. That’s just math, right? We can count on maybe 2% shrinkage this year in the share count?","{'neg': 0.0, 'neu': 0.84, 'pos': 0.16, 'compound': 0.5803}"
211,"Cap markets, the equity strength, how much of that – I know you highlighted across regions and you gave some great color, Ruth, on some of the various components, how much of a tailwind was Europe this quarter, just given some of the strength and on the back of QE there?","{'neg': 0.0, 'neu': 0.811, 'pos': 0.189, 'compound': 0.8885}"
212,"And then, thinking about Wealth Management here, can you give maybe a little color, I know it’s early, but on any potential impact from the Department of Labor proposal?","{'neg': 0.0, 'neu': 0.925, 'pos': 0.075, 'compound': 0.2732}"
213,"And then I know the loan growth environment is sort of tough, but sequential loan growth slowed somewhat and it looked like PLA slowed more than mortgage. Was there anything driving that? And should we ratchet down expectations for loan growth? Or was that more sort of like a single quarter type of a slow down there?","{'neg': 0.021, 'neu': 0.738, 'pos': 0.24, 'compound': 0.9354}"
214,"Last one from me, any chance to quantify the legal charge in both overall firm and in the Securities business?","{'neg': 0.0, 'neu': 0.749, 'pos': 0.251, 'compound': 0.5719}"
215,"On equities, and not really focused on the quarter, but if I look over the last like four quarters or six quarters, it seems like the traction or the progress has just been continuous and it’s been pretty consistent across products, across geographies. Just want to get a sense, like when you look at what’s going on in the equity business, and when you look at some of the pressures on the business and on the regulatory environment with clients, are you seeing more market share in areas where you guys are differentiating vs. the customers – or vs. the competitors? And then, is there any nuance between like the high touch, the low touch, or anything else? It just seems like the consistency and the traction has been just very consistent across the past, like, two years.","{'neg': 0.045, 'neu': 0.754, 'pos': 0.201, 'compound': 0.9782}"
216,"And then just a follow-up, you guys have set out the ROE target and you hit kind of around that area this quarter. And, James, it sounds like when you talked about dialing up the risk, it wasn’t one of those quarters where everything worked. I mean, there was obviously good progress, but it could’ve been better.I just want to get a sense of when you guys look at some of the things that can improve in terms of the Wealth Management pre-tax margin, things that you have control of, it still seems a little surprising when I think about a 10% ROE, and then I look at your business, 20% is Fixed Income, and then 80% is Equities, Banking and Wealth Management and Investment Management, things that we generally think of a higher ROE.So when I think about going over the next couple quarters, years, besides the things that you guys have control of, are there other things on the capital side or balance sheet side that’ll continue to boost that ROE? And I know the ROTE is higher, I think it’s around 12% vs. the 10%. But I just want to get your sense on what will be the drivers to improve that side of the margin in the Wealth Management business.","{'neg': 0.007, 'neu': 0.838, 'pos': 0.155, 'compound': 0.9853}"
217,"On the regulatory environment, the SEC seems to be focused on the potential abuse of fee-based accounts, so-called reverse churning. Given Morgan Stanley’s fee-based accounts have more than doubled since 2009, curious as to what kind of controls or checks you have in place to ensure the proper use of fee-based accounts at Morgan Stanley.","{'neg': 0.067, 'neu': 0.813, 'pos': 0.12, 'compound': 0.3182}"
218,"A question on just the tax strategy, I think tax benefit seems to be a recurring theme quarter after quarter. Just at a very high level, could you explain the firm’s tax strategy and how we should conceptually think about maybe tax benefits going forward?So there’s no wide tax strategy or anything in that kind of nature we should think about?","{'neg': 0.035, 'neu': 0.869, 'pos': 0.096, 'compound': 0.5803}"
219,"On the M&A backlog, I believe you said it was up y-over-y, how does it look on a linked quarter basis?","{'neg': 0.0, 'neu': 1.0, 'pos': 0.0, 'compound': 0.0}"
220,"And then on the funding cost benefits, how should we think about the allocation between FICC and Equities?","{'neg': 0.0, 'neu': 0.867, 'pos': 0.133, 'compound': 0.3818}"
221,"So certainly pleased to see the ISG comp leverage really show through in the quarter in light of the revenue strength. And I was just wondering how we should think about the comp leverage vs. the full year target of 39%, assuming you can actually deliver revenue growth for the full year.","{'neg': 0.0, 'neu': 0.801, 'pos': 0.199, 'compound': 0.8927}"
222,"And then maybe switching over to the capital side for a moment. We’re certainly pleased to see the significant build in the leverage ratio in the quarter. When parsing the individual components of that ratio, it looks like the improvement was really driven by a reduction in SLR add-ons more so than anything else. And I was just wondering if you could speak to what the current level is of those SLR add-ons and maybe how we should be thinking about sources of future mitigation potential.","{'neg': 0.0, 'neu': 0.861, 'pos': 0.139, 'compound': 0.891}"
223,"And then just lastly, on the Wealth Management side and specifically the new long-term deposit target of $200B which Greg spoke to at a recent investor conference. In the past, you’ve highlighted some metrics where maybe you’re under-penetrated relative to peers to help drive future growth, and was hoping in the context of this specific target whether you could highlight any specific metrics which would support that additional growth towards that $200B.","{'neg': 0.0, 'neu': 0.771, 'pos': 0.229, 'compound': 0.9517}"
224,"You had mentioned earlier about long-term debt cost coming down and I think implied you’re still early on in that process. Maybe if you could just size how much benefit you’ve had so far from that and try and shape how much opportunity is still in front of us.And do you have what the blended rate of your long-term debt is, the $155B?But just I mean conceptually, are we halfway through or still – I mean, your spreads have been coming in quite a bit, market rates have been coming down even just the past year here, so I would think there’s still a decent opportunity to bring those rates down.","{'neg': 0.044, 'neu': 0.879, 'pos': 0.076, 'compound': 0.5574}"
225,"Just maybe a follow-up on the capital question. You guys are substantially above on your Common Equity Tier 1 ratio, but on the SLR you’re just slightly above the minimum. So you have – how do you think about the interplay of the leverage vs. the common equity to a point where you can start to return even more of the common equity to maximize returns? Is there a lot more to go on the denominator in the leverage ratio? Or does it mean potentially more preferreds to maximize shareholder returns? How do you guys think about that dynamic over time and what kind of a cushion do you think you need on the SLR?No, I hear you, but on the CCAR, your constraining factors were more the Tier 1 ratios, right, the leverage, the total capital. So I’m just trying to get a sense, do you think there’s a lot more to do on the denominator side, or do you think it would make more sense to issue more preferred to kind of deal with that? Or do you think you have enough time to make more efficiencies on the balance sheet side? That’s what I’m just trying to get at.","{'neg': 0.0, 'neu': 0.959, 'pos': 0.041, 'compound': 0.8481}"
226,"Just a couple quick follow-ups here. So just on the bank and the strong loan demand, is it reasonable to think that you could skew more towards loans? And you’ve presented, I think, you’ve given kind of roughly 60% loans, the percentage of assets by 2016 end. Is that the optimal mix? Or if the demand is there, can we see that mix look more kind of lending heavy?","{'neg': 0.041, 'neu': 0.849, 'pos': 0.11, 'compound': 0.7219}"
227,"On the strength in EMEA in the quarter, it sounds like that was more trading heavy in the trading businesses. And so, were there any specific areas that really experienced improvement? And does that tone of activity still feel good and do you see that spilling into other businesses?","{'neg': 0.0, 'neu': 0.786, 'pos': 0.214, 'compound': 0.905}"
228,"Ruth, I wanted to focus one more question on the debt opportunity, and specifically on the legacy trust preferreds that you have outstanding. I think your plan previously was to potentially redeem most if not all of those this year. I’m wondering what the timing is on that based on your CCAR results this past go-round.","{'neg': 0.04, 'neu': 0.799, 'pos': 0.161, 'compound': 0.8225}"
229,"On the Investment Banking trends, very strong quarter across the franchise in trading. But I guess to James’ earlier point, you’re not hitting on all cylinders and banking within ISG was a little bit less strong. Can you give us some color as to sort of your outlook as to the potential opportunities or strengths within EMEA and Asia, specifically within the banking business?","{'neg': 0.0, 'neu': 0.804, 'pos': 0.196, 'compound': 0.9341}"
230,"The capital progress has clearly been solid this quarter. Last week, however, there seems to have been more support in the Fed in terms of including the SIFI surcharge in the CCAR test. I guess the question is in two parts. One, what do you think the chances are of any or all of the CCAR surcharge – or the CET1 surcharge – to be included in CCAR? And two, what are the next steps in terms of business model adjustments if that did pass?","{'neg': 0.0, 'neu': 0.863, 'pos': 0.137, 'compound': 0.8821}"
231,"You’ve clearly made progress in terms of your deposit mix. As we potentially anticipate a rising rate environment for the back half of the year, given what the regulators have done in terms of saying okay, here are the good deposits, here are the not-so-good deposits, how should we expect the pace and magnitude of retail deposit repricing or pass-through if the Fed does raise rates in H2 this year?","{'neg': 0.0, 'neu': 0.863, 'pos': 0.137, 'compound': 0.8519}"
232,"I see your Markets revenue are down 1% y-over-y the way you look at this. But I’m trying to reconcile that with Jamie’s comments two months ago at a New York conference where you said there’s repricing in rates, derivatives, prime brokerage, clearing, and trade finance. I’m guessing it’s just risk-off. So can you shed more light on what type of repricing you’re seeing with any specific examples because the transparency for us on the outside is pretty weak?So when you say a little repricing, is it bigger than a bread box? Are we talking about basis points or 1% or 5%? What are you talking about here?","{'neg': 0.0, 'neu': 0.951, 'pos': 0.049, 'compound': 0.7399}"
233,"Question on the deposit shrinkage. You obviously finished the program you announced at Investor Day. I’m just wondering if you’re going to take it further, what the impact on revenues has been. And do you expect that the full benefit to NIM is already in Q2 or in Q2 numbers, or we’re going to see more benefit in Q3 from the actions you took?And the NIM benefit should flow into Q3 as well?","{'neg': 0.0, 'neu': 0.858, 'pos': 0.142, 'compound': 0.8875}"
234,"Question on the deposit shrinkage. You obviously finished the program you announced at Investor Day. I’m just wondering if you’re going to take it further, what the impact on revenues has been. And do you expect that the full benefit to NIM is already in Q2 or in Q2 numbers, or we’re going to see more benefit in Q3 from the actions you took?And the NIM benefit should flow into Q3 as well?","{'neg': 0.0, 'neu': 0.858, 'pos': 0.142, 'compound': 0.8875}"
235,"Could you remind us about the timing of your expense reduction targets in the Consumer & Investment Bank. Specifically, if you hit the $57B in adjusted expenses for 2015, how much of the ultimate cost saves does that $57B target for this year incorporate? How much would you have achieved already in 2015, and any thoughts on the trajectory for remaining saves after this year?A quarter of the total?","{'neg': 0.0, 'neu': 1.0, 'pos': 0.0, 'compound': 0.0}"
236,"On RWA, any update to your year-end RWA targets and thoughts about how we should think about potential RWA levels longer term?","{'neg': 0.0, 'neu': 1.0, 'pos': 0.0, 'compound': 0.0}"
237,"In terms of your core loan growth, you mentioned that that’s up about 12% y-over-y. Can you give us a sense as to where that’s growing the strongest and where you’re seeing – perhaps where you’re seeing a bit more weakness within the core loan growth specifically.","{'neg': 0.06, 'neu': 0.752, 'pos': 0.189, 'compound': 0.6915}"
