,0,1
0,"The performance in equities was great, and you mentioned it’s pretty much across the board. Do you think there’s any seasonality, any one-time events, block trades, anything like that, that would lift such good performance in the quarter?","{'neg': 0.06, 'neu': 0.679, 'pos': 0.261, 'compound': 0.8689}"
1,"You and others have been talking with your prime brokerage clients to help improve ROAs in the business. Is part of that flowing through in just better equity performance, more business with clients?","{'neg': 0.0, 'neu': 0.779, 'pos': 0.221, 'compound': 0.8176}"
2,"In Jamie’s letter he talked about mentioning the need to push the new G-SIB rules to the product and the client level.And it piqued my curiosity. I’m just curious. How different is that from what you’ve already done? In other words, each step of the way you’ve been early in adopting and pushing out to the desk level higher capital charges. Does this just mean more of the same, meaning higher capital charge, higher capital charge, or is there something different there that you need to do?","{'neg': 0.023, 'neu': 0.935, 'pos': 0.042, 'compound': 0.168}"
3,"On net interest income, do you have an outlook for how the net interest income dollars could trend from here, assuming that you don’t get much help from higher rates, what are the key drivers? And what’s kind of your outlook for NIM and NII dollars for the year?","{'neg': 0.0, 'neu': 0.835, 'pos': 0.165, 'compound': 0.8426}"
4,"On CCAR, do you expect any potential surcharges on the CCAR to come out when the U.S. final rules on SIFI buffers come out? And in addition to that, have you learned anything from the CCAR in terms of the transparency of the process? Is there progression in terms of the back and forth with the regulators as you go through the CCAR process and their expectations?","{'neg': 0.0, 'neu': 1.0, 'pos': 0.0, 'compound': 0.0}"
5,"The drop in the adjusted expense is I think about 3% y-over-y came in a little bit better than we were thinking, while revenues were also a little bit better. Obviously, you’ve got a lot of cost saving programs underway that you mentioned earlier in the call and at Investor Day. But should we think that maybe you’re running ahead of schedule or that the cost saves could be more, or is it just lumpiness as we kind of go quarter-to-quarter?","{'neg': 0.02, 'neu': 0.935, 'pos': 0.046, 'compound': 0.2667}"
6,A big company out there announced it’s exiting most of its banking assets and just wondering if there’s any interest or appetite within your commercial bank to bulk up the acquisition there in terms of asset purchases vs. a complete company.,"{'neg': 0.0, 'neu': 0.833, 'pos': 0.167, 'compound': 0.7351}"
7,"On your CET1 ratio guidance. Do you give any kind of guidance on the Tier 1 leverage ratio by the end of this year, given your CET1 of 11%?Do you think there’s any way you’ll be able to kind of manage that ratio higher in the context of this year’s CCAR?","{'neg': 0.0, 'neu': 1.0, 'pos': 0.0, 'compound': 0.0}"
8,You mentioned that Treasury Service revenues were down due to the trade finance revenue area. And I noticed on the balance sheet the trade finance outstandings have dropped meaningfully on a y-over-y basis. Can you share with us what’s going on in that line of business?,"{'neg': 0.0, 'neu': 0.913, 'pos': 0.087, 'compound': 0.4588}"
9,"You mentioned that you have a very strong advisory business in the quarter, and you gained market share of 150BPS. Do you have any sense of who you took the market share from? Was it European investment banks or U.S.?","{'neg': 0.0, 'neu': 0.762, 'pos': 0.238, 'compound': 0.8736}"
10,"I just wanted to follow up on your energy comments. Could you help us understand what events it was that led to the reserve building? Was it company-specific events in the form of bankruptcies or just something else in your internal ratings migration?Okay, and just on that last point, your view on that is because of a recovery in prices rather than restructuring actions or things that your clients are undertaking. Is that fair or is it a bit of both?","{'neg': 0.0, 'neu': 0.908, 'pos': 0.092, 'compound': 0.7677}"
11,"To follow up on the energy point. Obviously, you have the reserving and then you mentioned the 200 basis point impact on spend. I’m wondering if you could just expand the discussion of energy. Are there positive offsets that you’re starting to see in the businesses elsewhere, either in terms of whether it’s credit or borrowing or investment banking opportunities that maybe popping up? Can you summarize the benefit if at this point you can see any positive offsets?","{'neg': 0.0, 'neu': 0.761, 'pos': 0.239, 'compound': 0.965}"
12,"With respect to the Securities Services business. You mentioned the change in presentation, and then there was the client loss. Is there a way you can help us understand just what the organic growth rate of the business is adjusted for the reclassifications, whether it’s on a sequential quarter or y-over-y basis?","{'neg': 0.04, 'neu': 0.777, 'pos': 0.183, 'compound': 0.8074}"
13,"On the capital ratio issue, you noted that standardized you’re at 10.8% and then you still feel that will be your constraining factor by the end of this year. So if you’re already at 10.8% and your target is 11%, I know it’s +/-, but it does seem like you’ve got three quarters to hit 20BPS. So is there anything unusual you’re expecting in the coming quarters, or is it just hey, you can never know quarter-to-quarter, but all else being equal, it looks like you can probably hit 11% if not better, is that a fair way to think about it?","{'neg': 0.029, 'neu': 0.884, 'pos': 0.087, 'compound': 0.7462}"
14,"On the G-SIB surcharge, with the proposal, do you feel better or worse? Are there any areas where you think you can pull the lever more significantly to improve that ratio, or lower the charge?","{'neg': 0.124, 'neu': 0.726, 'pos': 0.15, 'compound': 0.2786}"
15,"Going back to the reserve build, which obviously was done for the oil and gas as you mentioned, can you share with us? In the Corporate & Investment Bank, I know on a total dollar amount relative to the corporation it’s not significant, but there was a big increase in the nonaccrual loans from $110mm to $251mm in the quarter. Can you give us some color on what drove that?And again, that was not oil and gas related obviously. It’s in the CIB area. It was in the Commercial Bank.","{'neg': 0.015, 'neu': 0.93, 'pos': 0.055, 'compound': 0.5594}"
16,You highlighted the Swiss franc as a tailwind for FICC. Could you maybe size that for us?I know that the higher volatility of course would drive higher volumes. I was just talking about the events specifically and if there were some one-time gains involved in that so that we can adjust for a core figure here.,"{'neg': 0.0, 'neu': 0.956, 'pos': 0.044, 'compound': 0.34}"
17,"On the energy front, a lot of the focus was on the CB and the energy exposure there, but you all mentioned that there are exposures in CIB too. Can you give us maybe an update if there were any changes in any of those exposures or loans this quarter?","{'neg': 0.0, 'neu': 0.938, 'pos': 0.062, 'compound': 0.2732}"
18,"On your deposit discussion about pushing out, I think you said during your Investor Day that you would like to get about $3B of non-core deposits off the balance sheet, and I know you said that you hope to make progress in Q2. How should we model that out? And what type of benefit have you modeled out to the NIM with that $3B of deposits?","{'neg': 0.0, 'neu': 0.838, 'pos': 0.162, 'compound': 0.89}"
19,"On your deposit discussion about pushing out, I think you said during your Investor Day that you would like to get about $3B of non-core deposits off the balance sheet, and I know you said that you hope to make progress in Q2. How should we model that out? And what type of benefit have you modeled out to the NIM with that $3B of deposits?","{'neg': 0.0, 'neu': 0.838, 'pos': 0.162, 'compound': 0.89}"
20,Professional services was down like from $2B to $1.6B. Is that mainly due to some of that legal cost maybe starting to go away from the crisis?,"{'neg': 0.128, 'neu': 0.748, 'pos': 0.125, 'compound': -0.2732}"
21,"On the RWA progress that we saw in the quarter, and specifically was hoping that you could disaggregate how much of the sequential decline that we saw was a function of the planned mitigation actions and model benefits that you’ve cited vs. actual FX-driven declines? Because assuming that the U.S. dollar’s strength persists, all else equal, one could surmise that we should expect RWAs in a long-term context actually coming out below that $1.5 trillion target that you’ve cited in the past.","{'neg': 0.0, 'neu': 0.87, 'pos': 0.13, 'compound': 0.886}"
22,"On capital but relating to CCAR. You’ve noted on this call and in the past that you don’t expect CCAR to be JPMorgan’s binding constraint longer term. But just given the reduction that we saw in the ask or the need to use the mulligan in the last exam, I was just hoping you could cite some of the planned mitigations actions that you expect to take so that we could see you guys get on the path towards delivering on that 55% to 75% net payout target.","{'neg': 0.0, 'neu': 0.959, 'pos': 0.041, 'compound': 0.5719}"
23,"You warned in your annual letter about the possibility of another flash crash. Yesterday, I think Simon Potter at the Fed warned about it and cited HFT as one of the issues. Larry Summers warned about it about a week ago. Are these warnings going anywhere, I mean are they being translated into action anywhere in the system?","{'neg': 0.183, 'neu': 0.817, 'pos': 0.0, 'compound': -0.8481}"
24,"The returns in Commercial Banking have remained in sort of the high teens over the last number of quarters and it’s certainly respectable, sort of 17% to 19%. Is there any way those returns improve materially as rates go up, or does that get offset by competitive factors? And are we at sort of a normalized level for that business?","{'neg': 0.0, 'neu': 0.824, 'pos': 0.176, 'compound': 0.8611}"
25,"Thank you so much for giving us a detailed rundown in terms of how you’re thinking about your liquidity strategy. And I also appreciate the $28.4B in deposit growth came from consumer and escrow. But taking a step back of the $1.2 trillion in period-end deposits, how much would you classify as non-operational corporate? And I guess, we’re just wondering, is adopting a similar strategy as your other large bank peers on non-operating deposits, will that be able to alleviate some of the liquidity pressure on the NIM without much give-up on the LCR?I guess, a better way to think about it is a lot of this excess deposit growth is going be positive for your LCR and NSFR given that it looks like it’s mostly retail, so low outflow, high ASF factor type of deposits.","{'neg': 0.043, 'neu': 0.802, 'pos': 0.155, 'compound': 0.9391}"
26,"And just as a follow-up and I’ll step back. You’ve been very consistent in terms of falling in that 55% to 59% efficiency ratio range. And you’re consistent in terms of your forward guidance. I guess, again, given some of the other large bank guidance and efficiency out there, will thetake rates for Wells Fargo to move further down to the 55% portion of that range?","{'neg': 0.023, 'neu': 0.875, 'pos': 0.102, 'compound': 0.6597}"
27,"Can you put into context for us whether the investment opportunities that you discussed that you see before you at the moment are growing? Or are they getting harder to identify as you look ahead at the next 12 months vs. the last 12 months?And then relating to these investment opportunities, how should we be thinking about the trajectory of your payout ratio longer term? As you generate more capital going forward, is it fair just to view your payout ratio as being inversely related to your investment opportunities? I guess, I’m asking from the perspective of, just, kind of, a general overall view that higher payout ratios are better. But I’m wondering if that’s really how we should be thinking about it for Wells Fargo, given that your capital position is already largely optimized and you’re not sitting on a lot of excess capital at the moment, so when and how should we be thinking at that?I think the GE Capital case, any other RWA growth for attractive return generation?","{'neg': 0.0, 'neu': 0.863, 'pos': 0.137, 'compound': 0.9685}"
28,"On a dynamic that we’re seeing with loan growth outpacing deposit growth across the banking system as a whole. But for the larger banks, including Wells Fargo, I guess, we’re still seeing deposit growth outpacing loan growth. I was hoping that you could just talk about what you think may be driving that? And do you see anything on the horizon that you think could change that? I guess, in other words, just lead to loan growth outpacing deposit growth at the large banks as well?","{'neg': 0.0, 'neu': 0.714, 'pos': 0.286, 'compound': 0.9785}"
29,"John, we wanted to ask – just go back to the efficiency ratio. Is it reasonable to expect kind of as long as rates stay low and credit is as good as it is right now, you’re likely to stay at the upper end of your targeted range? I think John Shrewsberry, you said last call you’d be okay kind of staying at the higher end of the – in this kind of environment. And is there any expenses that are kind of still cyclically elevated? Maybe just give a little more color there.","{'neg': 0.022, 'neu': 0.873, 'pos': 0.105, 'compound': 0.7998}"
30,"Okay. And on TLAC, John, is there kind of some thoughts that you could share in terms of preparing for TLAC? The rules obviously aren’t finished yet. But are you taking steps to kind of prepare for your assessment of the most likely proposal that you’d see on that front?Oh, no. I’m sorry. Go ahead. I was going to say is preferred as well? If you could just kind of – where are you on preferreds relative to where you think you might need to be?","{'neg': 0.047, 'neu': 0.879, 'pos': 0.074, 'compound': 0.3421}"
31,Could you provide any color to help us understand the new loan purchases? Is there any way to put in context either the yield of the portfolio relative to the existing yield of the Wells Fargo book? And do you bring over expenses with it? Or is it largely just interest income coming over as has happened in your prior acquisitions of loan books?,"{'neg': 0.0, 'neu': 0.876, 'pos': 0.124, 'compound': 0.8253}"
32,"With regards to potential other portfolios that GE had talked about, given your positioning in terms of helping them through the structure, as you mentioned, do you guys get a different look? Or have you already taken a look at other parts of the book and this is just the first tranche of what could be more? Or what’s your just general perception of the opportunity set that could come forth for Wells Fargo?","{'neg': 0.0, 'neu': 0.901, 'pos': 0.099, 'compound': 0.7608}"
33,"Okay. And then one little just follow-up on your credit comments. Understanding that energy is baked into this quarter and that you still net release reserves, can you just kind of give us the pushes and pulls within the credit buckets in terms of how much more improvement do you continue to see on the rest of the books, ex the energy side? Or have we really just kind of gotten to the end of the natural improvement?","{'neg': 0.0, 'neu': 0.771, 'pos': 0.229, 'compound': 0.9568}"
34,"Just a couple quick questions. So, John, the tax rate has kind of bumped around. And this quarter obviously, you had the discrete issue that you called out, but what’s the appropriate FTE tax rate to use going forward?","{'neg': 0.0, 'neu': 1.0, 'pos': 0.0, 'compound': 0.0}"
35,"Yeah, exactly. Okay. Thank you. And then the other one, when you had been talking about the mobile growth, you had noted also that branch use has not been declining. I guess, just from you guys’ perspective, who’s coming in and what kind of stuff are they doing? And just as you look at overall branch traffic and the need for branches, is it a good thing that people are still coming in and that it makes for an easier, more direct cross-sell or is it more of a negative in that, you have to make mobile investments, but you can’t really leverage via fewer branches necessarily or as much branch reduction as you might hope? How do you think about that dynamic?","{'neg': 0.019, 'neu': 0.843, 'pos': 0.138, 'compound': 0.9144}"
36,"Compared to Q4, the commercial loan growth was a little slower outside of real estate construction. Was some of that seasonal or were there other factors in play there? How do you feel about the current levels of demand on the commercial side?","{'neg': 0.033, 'neu': 0.85, 'pos': 0.117, 'compound': 0.594}"
37,I was curious what your early read is on the spring selling season this year. I know you’re starting to see any signs for return of the first time home buyer.,"{'neg': 0.0, 'neu': 0.924, 'pos': 0.076, 'compound': 0.3182}"
38,Can you talk a little bit more on the housing backlog? How does it look by region and what are the areas of strength?,"{'neg': 0.0, 'neu': 0.861, 'pos': 0.139, 'compound': 0.5514}"
39,"You talk very positive about your mobile banking, your online banking, which I think everybody’s having that same trend. But I know you opened a couple, like, express branches or whatever you want to call them in the Washington, D.C. area. How are they working out? Are you planning to expand those type of branches?And also, over by NoMa, you also opened up one in the Safeway, or I think it was a Safeway out there.I mean, I know a lot of people are moving away from supermarket banking. I don’t think you were a big player in that area, but is that working out also?","{'neg': 0.0, 'neu': 0.897, 'pos': 0.103, 'compound': 0.8637}"
40,"The risk – there have been several articles recently, one a couple days ago, I think maybe in the Wall Street Journal or somewhere about the changing risk profile at Wells Fargo. And they look at increased percentage of revenues coming from investment banking and assign a risk premium to that. Could you just address the whole issue? And just sort of frame out for us how big you want investment banking and/or capital markets activities to be there?So I guess, that’s sort of it may or may not grow?","{'neg': 0.075, 'neu': 0.866, 'pos': 0.059, 'compound': -0.3485}"
41,"In mortgage banking, if you could just repeat what you said about gain on sale, I missed the number and where you expect it to be in Q2?","{'neg': 0.071, 'neu': 0.777, 'pos': 0.152, 'compound': 0.3612}"
42,On the mortgage competitive landscape here. We saw JPMorgan out earlier today with a big increase in correspondent originations vs. a year ago. And maybe you’ve been a little more consistent in that business. But if you could just remind us on the correspondent and talk about the mix that you’re going after right now?,"{'neg': 0.0, 'neu': 0.943, 'pos': 0.057, 'compound': 0.25}"
43,"And then just circling back on expenses and I guess, I’m focused on, call it, the people costs, the salaries, commissions, incentive comp, employee benefit. If you sum those three lines, it’s up, I think, 6%, 7% vs. a year ago. I know there’s the trading, kind of, nuance that we need to adjust for. But is there some impact of the mortgage pipeline impact on those numbers as you kind of staff up in anticipation of a higher volume? I’m trying to reconcile why that growth might be so much vs. revenue and some of the categories and fees?Any way to size that either on an absolute basis or vs. a year ago? Is that overall bucket of, call it, non-revenue related costs?","{'neg': 0.0, 'neu': 0.908, 'pos': 0.092, 'compound': 0.8594}"
44,"On your energy-related comments, can you just clarify if there was in fact any increase in general or specific reserves for that portfolio or any downward migration, internal risk ratings or anything of that nature?","{'neg': 0.056, 'neu': 0.882, 'pos': 0.061, 'compound': 0.0516}"
45,"One of the other institutions indicated that based on the forward price curve, they would expect some of the pressure on E&P sector to subside. Is that a view that you share?And typically when is that?","{'neg': 0.07, 'neu': 0.93, 'pos': 0.0, 'compound': -0.3736}"
46,"To drill into the mortgage banking, when we managed ours, we had this recognition origination at close and not interest rate lock, whenever prepayments kicked in, servicing income kind of was compressed as you had to write-down the servicing for the expected prepayments. But origination income wasn’t at its full run with refi. I was trying to look at this first quarter as kind of the launching pad going into a much stronger return on revenues and mortgage from that timing effect.","{'neg': 0.021, 'neu': 0.938, 'pos': 0.041, 'compound': 0.3939}"
47,"Two follow ups to that thought process. 71BPS on the servicing portfolio has to be closed to all-time low. Are we getting to the point that even with prepayments we wouldn’t need much more revaluation, given that you’ve already incorporated a lot of the expected prepayments into the current evaluation?","{'neg': 0.042, 'neu': 0.958, 'pos': 0.0, 'compound': -0.2732}"
48,"When you convert your unclosed pipeline of $44B into what would be a normal pull-through into originations in the next quarter, I get to something like $75B to $80B. Does that seem about right in a sense that that’s the kind of run rate you’re getting into at this point?Good thing is that half of it is already done in the unclosed pipeline. So you at least know that part.","{'neg': 0.0, 'neu': 0.964, 'pos': 0.036, 'compound': 0.3612}"
49,"On the margin, wanted to get some color on the 13-basis point decline in commercial loan yields. I know you indicated that was partly impacted by fees. Did the lower loan fees account for all of that or how much of it was downward pressure on yields from pricing pressure?And then how does that play into your margin outlook? Is it fair to assume still mid-single digit basis points compression per quarter as we move through 2015?","{'neg': 0.054, 'neu': 0.882, 'pos': 0.064, 'compound': 0.212}"
50,"Could you talk about loan growth expectations? You saw declines in your total CRE book. Want to get some thoughts around a sustained inflection in that portfolio organically, and then is it also fair to assume that the loan growth overall should remain in the mid-single digit range at this point?","{'neg': 0.0, 'neu': 0.834, 'pos': 0.166, 'compound': 0.7998}"
51,On the credit side. The oil and gas reserve post what you did this quarter. Can you quantify where that reserve stands right now?,"{'neg': 0.0, 'neu': 0.898, 'pos': 0.102, 'compound': 0.3818}"
52,"Can you guys share with us some of the color – you’ve had real big success on the commercial loan growth on a y-over-y basis, in particular, commercial mortgage is real strong. Could you share with us where that growth is coming from. Is it geographically, is it Southeast vs. the Midwest or where is the best growth coming from?","{'neg': 0.0, 'neu': 0.681, 'pos': 0.319, 'compound': 0.9698}"
53,I see. And then can you guys give us any color on the utilization rates of the commercial lines? Did they go up this quarter? Some of your peers are suggesting higher utilization rates.,"{'neg': 0.0, 'neu': 1.0, 'pos': 0.0, 'compound': 0.0}"
54,"And then one final question, can you just give us an update on your monetization program of the internal systems, obviously it’s elevated spending, how long do you expect that to last?","{'neg': 0.0, 'neu': 1.0, 'pos': 0.0, 'compound': 0.0}"
55,"Can you give us an update on the RBC acquisition down the south, where you stand there and how the growth has been – you experienced the growth from there?","{'neg': 0.0, 'neu': 0.839, 'pos': 0.161, 'compound': 0.6369}"
56,"And the overall loan book – wheredo you stand like C&I and stuff like that down in the Southeast?Well, just in terms of growth, I mean like you’re getting good account acquisitions on the loan growth side, where does it stand?","{'neg': 0.0, 'neu': 0.674, 'pos': 0.326, 'compound': 0.932}"
57,Just a couple of rate-related questions. If we get rising short-term rates but nothing on the long end and I guess in between things go up a little bit but not as much as the short end so you get a flattening yield curve. Remind us how sensitive you are to that scenario?,"{'neg': 0.0, 'neu': 1.0, 'pos': 0.0, 'compound': 0.0}"
58," And then just if you thought that rate increases weren’t going to happen for longer – materially longer, not just pushing out three months, are there additional costs that you would cut and how meaningful could those be?","{'neg': 0.053, 'neu': 0.888, 'pos': 0.058, 'compound': 0.0516}"
59,"And then just lastly, if we look at – call it the people cost, I think you call it personnel, they were up about 7%. We’re seeing similar increases at some of your high quality peers like USB and Wells, and everyone is pointing to kind of the infrastructure, risk management increases, you can talk about it for a while. But has something changed in the last six months, nine months, that’s causing everybody to ratchet these up or is it just a progression of what we’ve seen in the last couple of years?","{'neg': 0.017, 'neu': 0.948, 'pos': 0.035, 'compound': 0.1779}"
60,Couple of questions. Just on the expense theme here. So in Q1 you mentioned 30% – more than 30% of the $400mm outlined in efficiency improvements were reached in first quarter. Do I take your comments to mean you reinvested all of that into the IT investment program? Or was any of that dropped to bottom line?,"{'neg': 0.0, 'neu': 0.888, 'pos': 0.112, 'compound': 0.6767}"
