,0,1
355,"Just to follow up on two issues very quickly as we wrap up the call here. One, Rob, I just wanted to make sure I understood your commentary about loan growth across the newer geographies. It seems like the – sort of the run rate for the industry is somewhere in the sort of 6% to 8% annualized level. But did I understand your commentary to mean that it’s in line with that off of a low base? Because intuitively, it seemed like it should be somewhat greater than the industry average, just given......the starting point.","{'neg': 0.049, 'neu': 0.838, 'pos': 0.112, 'compound': 0.6497}"
356,"Okay. Great. Thanks. And then, my second question is, Rob, in the context of your commentary that as rate expectations changed, you had to make some changes to your expense outlook. But you may be at this point in the minority of thinking that the next Fed hike is coming in September.If, in fact, that gets pushed out by a quarter or two, would that necessitate another change?Or did the change you make anticipate potential additional slippage?","{'neg': 0.029, 'neu': 0.893, 'pos': 0.078, 'compound': 0.4606}"
357,"May be we could talk a little bit just about the expense trajectory from here. You highlighted high regulatoryexpenses and some investments in U.S. cards. But may be y ou can kind of give us – but y ou also haven't seen much of a decline in markets expenses in the Corporate Bank y et, seasonally, we should expectsome decline in revenues and then lay ering, maybe layering on top of that data on a single operating platform in the global retail business and what that could mean for expenses longer-term. Thanks.","{'neg': 0.0, 'neu': 0.932, 'pos': 0.068, 'compound': 0.7227}"
358,"But ex-rates, y ou would say 55% is sort of y our steady state?","{'neg': 0.0, 'neu': 1.0, 'pos': 0.0, 'compound': 0.0}"
359,"On the DTA, you used up $1.2 billion last quarter. It seems like that dropped to about using up $300 million this quarter. Yet it looks like North American net income was pretty similar to last quarter. Why the bounce? Why not using more DTAs this quarter?","{'neg': 0.0, 'neu': 0.837, 'pos': 0.163, 'compound': 0.8205}"
360,On the timing and the puts and takes. You mentioned OneMain being the late third quarter hopeful. Can the debt repurchase coincide with that? How long of a delay there? And then alsoCostco coming in; I'm just more of timing the good guidance y ou have given us on the puts and takes on the NIM in the back half and going into next year.,"{'neg': 0.068, 'neu': 0.839, 'pos': 0.093, 'compound': 0.4137}"
361,"I look for some clarification on the Equity's, in the $175 million-ish, I think you said, charge on valuation side. What were you financing, why is it get revalued? I'm just curious of the mechanics, I understand that it's not going to repeat, I hope. Does that mean there's some realized losses related to PB balances? Because it's a rare...","{'neg': 0.045, 'neu': 0.863, 'pos': 0.092, 'compound': 0.4329}"
362,"Given all the volatility in [ph] FIC (34:44) and your EM heavy franchise, the local markets franchise; I thought the performance is good considering all the disruption late in the quarter. I'm just curious, was there a disruption late in the quarter? And of the things that happened late in the quarter, have we seen a reversal of any of that so far in July ?","{'neg': 0.073, 'neu': 0.846, 'pos': 0.081, 'compound': 0.1431}"
363,"Just to clarify , you guys sort of adjusted the GCB target for the full y ear versus last quarter. But is there any impact to y our target that you're shooting for to exit the year, or does that still remain in the previous range?","{'neg': 0.0, 'neu': 1.0, 'pos': 0.0, 'compound': 0.0}"
364,"And I know that sequential quarter deltas can be somewhat difficult, but is it possible to provide some color on what drove the pickup in Citicorp expenses quarter-over-quarter on a constantdollar basis, and may be the quarter-over-quarter uptick in core efficiency for GCB? And those regulatory and compliance costs are captured in the core expense as opposed to be considered legal and repositioning, right?","{'neg': 0.024, 'neu': 0.894, 'pos': 0.081, 'compound': 0.5799}"
365,"And so is that why y ou guys highlighted on the expense front in International GCB that y ou had the uplift from volumes, but y ou didn't see that translation into revenue? Is that because of that re gulatory headwind?","{'neg': 0.0, 'neu': 1.0, 'pos': 0.0, 'compound': 0.0}"
366,"Thinking about Holdings in the North American mortgage book, as of last quarter, about $24 billion or so of the $54 billion mortgage was second lien, which is my understanding that it's basically not marketable. So I'm just kind of curious, of the remaining roughly $50 billion of mortgage that is first lien, how much of that do you carry the corresponding second lien on your balance sheet? And therefore, youprobably wouldn't want to sell those mortgages to put yourself, kind of arb yourself negatively in the structure? Just try ing to think about sizing, what's left to sell in mortgage?","{'neg': 0.012, 'neu': 0.963, 'pos': 0.025, 'compound': 0.3237}"
367,"The color on the NIM, in terms of OneMain and some of the offsets was helpful. Just as to try and put it alltogether and think aboutthe earnings impactand the capital impactof those three things, OneMain, Costco, debt restructuring; any color there y ou can give us?","{'neg': 0.051, 'neu': 0.892, 'pos': 0.057, 'compound': 0.0772}"
368,"Okay . Or  the earnings impact? Yousaid offset at least half the NIM drag, but obviously there's some credit costs and expenses and things like that, especially related to OneMain as well.","{'neg': 0.038, 'neu': 0.681, 'pos': 0.281, 'compound': 0.8519}"
369,"Within North America retail banking, you mentioned the deposit spreads were improving, and that was a key driver of the revenue. What's driving the better deposit spreads? Is that just mix, or what is that exactly?","{'neg': 0.0, 'neu': 0.845, 'pos': 0.155, 'compound': 0.7236}"
370,"With regard to y our efficiency ratio, you're at 55 % for Citicorp. Y ou mentioned the growth in some of the regulatory costs should abate next year. Andy ou also said it should be better if and when interest rates go up. So  – and y ou still have Project Rainbow, actually if y ou could give an update on that. So where should the long -term efficiency ratio go? And at what point would y ou think about being more aggressive with that target? And again,   an update on Project Rainbow.","{'neg': 0.02, 'neu': 0.835, 'pos': 0.145, 'compound': 0.8994}"
371,"What about your ROA target? You're at over 100 basis points. The low end is 90 basis points. At what point would you consider increasing that target? I'm not saying to do away with concrete targets over aconcrete timeframe, but for next year or long-term normalized, where should the ROA be?","{'neg': 0.04, 'neu': 0.96, 'pos': 0.0, 'compound': -0.2709}"
372,"And then just going back to the – my earlier question, one factor that's more unique to y ou guys, Project Rainbow, as y ou consolidate your systems, y ou think y ou'd have more efficiency gains from that, unless y ou're going to reinvestsome of the savings. Where do y ou stand with that?","{'neg': 0.0, 'neu': 0.894, 'pos': 0.106, 'compound': 0.6674}"
373,"The revenue in Corp/Other has jumped up a little bit in the last few quarters, and I know you mentioned some gains. If you could talk a little bit about what level that might be a little bit more sustainable at?","{'neg': 0.0, 'neu': 0.938, 'pos': 0.062, 'compound': 0.34}"
374,"Looking at International Consumer loan growth, it looks like trends are pretty good, ex-Korea and just wondering sort of what your outlook was there?","{'neg': 0.0, 'neu': 0.641, 'pos': 0.359, 'compound': 0.8807}"
375,"So, John, I had one quick question on capital. I was hoping y ou could give us some inside or incremental color on what contingency plans y ou might have in place if the Fed were to incorporate G-SIB surcharges in CCAR, just given that it could have a pretty meaningful impact on y our return profile as well as y our payout capacity.","{'neg': 0.0, 'neu': 0.836, 'pos': 0.164, 'compound': 0.8555}"
376,"On DTA I did appreciate the color y ou'd given surrounding the AOCI impacts weighing on the pace of consumption, but just wanted to get a sense as to what drove the increase in the net operating losses, just given AOCI hits are ty pically a timing DTA issue and it did increase by north of $500 million, which is not immaterial?","{'neg': 0.052, 'neu': 0.783, 'pos': 0.165, 'compound': 0.765}"
377,"Just a follow-up question on the expense ratio and just a little bit of a different angle on asking about theConsumer, where you indicatedthat for the near-term the expense ratio would rise as y ou're reinvesting in the business. I noticed you didn't change the overall company expense ratio, so just wanted to see if what y ou're  say ing is y ou've got other cost saves even further ahead of plan happening elsewhere in the organization that's funding this investment spending Consumer or you're saying, look, we see good payback, relatively good timeframe, and as a result we're just going to let this rise up a little bit as we're reinve sting and we'll get it back next y ear?","{'neg': 0.0, 'neu': 0.949, 'pos': 0.051, 'compound': 0.7003}"
378,"When you're thinking about where you're putting your expense dollar to work, is U.S. Consumer the best place right now?","{'neg': 0.0, 'neu': 0.819, 'pos': 0.181, 'compound': 0.6369}"
379,"On Card, you indicated that you're likely to get back some of the NIM compression from the exits in part from portfolios like Costco, understanding that there's some other portfolios out there that could be of interest to you. Could you just give us a sense as to how you're thinking about what kind of financial hurdles and goals you have in mind when you're looking at portfolios for purchase?","{'neg': 0.0, 'neu': 0.924, 'pos': 0.076, 'compound': 0.6705}"
380,"My question is on how y our best-in-class capital ratios, particularly on leverage, is impacting y our clientconversations in markets? Do y ou get a sense that some of y our competitors that have, for example, a much lower SLR and, therefore, have less balance sheet to give are being less aggressive with, in terms of competing in markets, or not really? Is competition really as fierce as ever and the leverage ratio differences aren't really making an impact?","{'neg': 0.054, 'neu': 0.946, 'pos': 0.0, 'compound': -0.4673}"
381,"Got it. And just a follow-up question; John, the way yousort of answered Steven's G-SIB question on the CCAR, I'm assuming also that until we get final rules on TLAC, we won't see y ou guy s legging in any potential issuance ahead of having the rules finalized in the U.S.?","{'neg': 0.0, 'neu': 1.0, 'pos': 0.0, 'compound': 0.0}"
382,"And based on y our understanding of the proposals, could y ou give us a range on what y our TLAC is at the end of the quarter, the TLAC ratio?","{'neg': 0.0, 'neu': 1.0, 'pos': 0.0, 'compound': 0.0}"
383,"Good afternoon, gentlemen. Thanks for taking my calls – my questions. Just, John, just a question on the U.S. branch sy stem; that's down about 15% y ear-over-year. However, you'v e got sort of expense reductions, at least reported expense reductions down about 3% y ear-over-year. Is there more to go in terms of the U.S. branchcount? Or are y ou pretty much done with that?","{'neg': 0.0, 'neu': 0.859, 'pos': 0.141, 'compound': 0.8541}"
384,"On your comment in terms of Investment Banking taking market share. It sounded like y ou were taking more market share in North America, perhaps than – at least in this quarter, than y ou did outside the U.S. Is that also true in the Markets business because a number of other banks this quarter have implied that they continue to get market share at least on the Markets side of the equation outside the U.S. to a greater degree than they are getting it within the U.S.?","{'neg': 0.0, 'neu': 0.829, 'pos': 0.171, 'compound': 0.9136}"
385,"The 26% increase in Equity Markets, if we exclude the valuation adjustment, how much of that was the result of improved activity in Asia?","{'neg': 0.067, 'neu': 0.742, 'pos': 0.191, 'compound': 0.5423}"
386,"Thanks very much. John, just a couple of clarification questions, please. One, I just want to make sure on the efficiency guidance for GCB, was that new guidance than what y ou'd previously stated?","{'neg': 0.0, 'neu': 0.697, 'pos': 0.303, 'compound': 0.8519}"
387,"On the debt repurchases and the debt issuance that you went through with Erika a moment ago, were those consistent with the plans for this year? Or is the plan different than the one that we talked about last quarter?And the pull-forward presumably was because of rate and market opportunity?","{'neg': 0.102, 'neu': 0.847, 'pos': 0.052, 'compound': -0.4098}"
388,"John, can y ou remindus, putting off to the side for a moment the possibility of G-SIB being included in CCAR, but can y ou remind us what the binding constraint on the capital ratio, which ratio y ou guys are looking at as that binding constraint?","{'neg': 0.0, 'neu': 1.0, 'pos': 0.0, 'compound': 0.0}"
389,"You've talked about growing the card business, and you've had success with acquisitions and now you're putting more muscle into growing thatbusiness organically. As you go on the offense from the defensive position you'v e been in in the past, are there other areas you guys are looking to grow possibly through acquisitions, separate from cards?","{'neg': 0.033, 'neu': 0.831, 'pos': 0.136, 'compound': 0.6369}"
390,"And then my final question, overall creditcontinues to improve for y ou folks and the industry, but I did notice   that in the non-accrual area or in Corporate, North America sequentially had a jump in y our non -accruals whereas Latin America you had a significant improvement. Could y ou give us some color on both of those line items?And was that as a result of the Shared National Credit Exam, I assume? Or no, it was something separate?","{'neg': 0.034, 'neu': 0.783, 'pos': 0.183, 'compound': 0.9079}"
391,"On the North America cards and the additional investment spend. When you think about it from a receivablespoint of view, when you have the additional investment spend, what are the expectations around receivable growth? Is that investment spend needed just to stabilize receivables, or are you expecting growth above and beyond what you have already? Because from 1Q to 2Q, you saw 8% growth annualized, so are you looking to get even further beyond that with this additional investment spend?","{'neg': 0.0, 'neu': 0.901, 'pos': 0.099, 'compound': 0.8095}"
392,"On the Citi Holdings assets; I think you said that Citi Holdings is now 6% of total assets, and it looks like from the footnote it's more like 13% of your risk-weighted assets, so it looks like the risk-weighted assets in Citi Holdings are not coming down as fast as total assets. Do you think that kind ofrelationship will continue, and is it related to any particular type of asset in Citi Holdings?","{'neg': 0.0, 'neu': 0.739, 'pos': 0.261, 'compound': 0.9509}"
393,"John, I was very curious in y our comment, most of the banks are getting asked about SIFI and the inclusion into CCAR. The analy sis that we had done, there was some talk about countercyclical buffer at the very beginning of this going into SIFI. If y ou look at the countercyclical buffer average for the money center banks, 2.5%, the credit losses in CCAR average 2.7 %. If y ou look at the SIFI buffer average for the money center banks as it kind of looks right now, it's around 3%. And if y ou look at operational losses, it's actually 3.1%.So y our concept of, well, if they throw the overall SIFI buffer into CCAR, then they 'd have to make s ome adjustment to operational losses; I think I just was going to ask y ou to kind of think about that and expand on that concept.","{'neg': 0.053, 'neu': 0.883, 'pos': 0.063, 'compound': 0.1263}"
394,"Just on say ing that it would be coincidental that these buffers are almost equaling the losses in CCAR, and then when y ou look at the non-money center banks, they have very little operational loss at all and they don't have any SIFI buffers. So it's just the parallel calculations seem to be more than just trivial.","{'neg': 0.101, 'neu': 0.899, 'pos': 0.0, 'compound': -0.6231}"
395,"As you look at your tangible book value, without these extracharges because you've had a lot of that already reserved and who knows what's ahead, but let's just assume that less is ahead versus what we've seen in the past. Your ability to repurchase at or below tangible book value and the returns improving, growth this quarter annualized in tangible book value is ab out 8%. It just seems like that acceleration could continue into the future and just wanted to see your thoughts on that. ","{'neg': 0.0, 'neu': 0.786, 'pos': 0.214, 'compound': 0.9648}"
396,"With the wind down of Citi Holdings and how that impacts risk-weighted assets because you mentioned the $34 billion, which you have basically got baked in, and you just touched on the relationshipbetween the GAAP assets and the RWA. So if we were to be looking at what is going to happen to the $1.279 billion of RWA you had fully-phased at the end of the secondquarter? I mean, obviously I would imagine that a  minimum would be $34 billion coming off that pro forma. And I suppose th e question I'm asking is how muchmore might come off in respect to the uplift between the GAAP assets and RWA? And also perhaps how much you think you might use in actually growing the business during that period? ","{'neg': 0.0, 'neu': 0.919, 'pos': 0.081, 'compound': 0.8146}"
397,"I think FICC and I&L take a lot of everyone’s focus, but in FICC specifically, I wonder if you could help us, how much of that was a late quarter phenomenon? You spelled out what fell off in credit and mortgage, things like that. How much was a late quarter? How much have you seen some stabilization or reversal so far? And then most importantly, I think last quarter you felt really good about market share in client facilitation side of the business, and I’m curious if you can give any comments on parsing that out, the facilitation vs. the marks in the quarter? Thank you.","{'neg': 0.0, 'neu': 0.768, 'pos': 0.232, 'compound': 0.9815}"
398,"And then I think you talked about the competitive landscape in flux and we all see what's going on at each and every one of the European banks. I think your franchise composition is different in general. You see it in results this quarter, and mostly good. Just a question on the European shrinking. Do you want what they're shrinking? In other words, theoretically, they're going to shrink the tougher parts, the lower ROA types of the business.I don't want to put words in your mouth, but it sounds like there might be more volatility, but in the end, your shareholders are going to love the fact that you are bigger in some of those areas.","{'neg': 0.013, 'neu': 0.856, 'pos': 0.131, 'compound': 0.9081}"
399,"On the CCAR and G-SIB - possible G-SIB's surcharges. So I'm sure y ou're aware that this chatter that that could be included in the CCAR process going forward. You know, you have been or Goldman has been pretty proactive in optimizing for CCAR, be it preferred issuance or reducing the gross balance sheet, but what are the levers can you pull if G-SIB buffers are included?","{'neg': 0.029, 'neu': 0.859, 'pos': 0.112, 'compound': 0.5774}"
400,"Okay . That's helpful. And then litigation costs, so how should we think about go -forward litigation costs? I guess over the last four quarters, y ou've averaged about $200 million per quarter, just given the big charge this quarte r, all else equal, should we expect that run rate to slow down a bit?So it doesn't sound like any thing changes in terms of just kind of look forward here?","{'neg': 0.086, 'neu': 0.85, 'pos': 0.064, 'compound': -0.1406}"
401,"On the equity trading, so year-over-year, the strength was pretty significant. I think you mentioned a few drivers of that. But are you seeing any market share gains in that part of the business or is it more environment and clients' investors getting more active in the asset class? I know y ou pointed to Asia, but I just wanted to find out if there was any thing else driving that?","{'neg': 0.0, 'neu': 0.754, 'pos': 0.246, 'compound': 0.9533}"
402,"Just two kinds of minor items, but on the legal cost, you mentioned this reserve, and it's always tough in terms of the outlook. But when you think about some of the major things that you guys have put behind you, and even the industry, when we think about the run rate going forward, are the majority of those items behind y ou?","{'neg': 0.028, 'neu': 0.945, 'pos': 0.028, 'compound': 0.0}"
403,"And then on the tax rate, just wanted to understand, if I exclude the item related to the legal reserve, it looks like the core tax rate still was relatively low versus expectations, in line with last quarter. So is the revenue mix away from the legal charge still beneficial? Meaning it's still coming in in lower jurisdictions? And so does that, for the full year, should we be thinking about that continuing?","{'neg': 0.077, 'neu': 0.811, 'pos': 0.112, 'compound': 0.4098}"
404,"Maybe a bigger picture question, on your traditional bank strategy, you had a key hire on the consumer side, or former consumer person. Maybe just talk about what you're thinking there on traditional bank strategy in general?","{'neg': 0.0, 'neu': 1.0, 'pos': 0.0, 'compound': 0.0}"
405,"And then may be separately, you mentioned head count was up just 1 % linked quarter. Year -over-year, it's up 8%. Obviously, it's not causing any expense pressure as the expense management's been good, but just remind us just where those people are being added? And I guess are they more kind of junior, lower salaried staff?Sorry , three-quarters of the people in the reg-related staff or of the additions?","{'neg': 0.071, 'neu': 0.901, 'pos': 0.028, 'compound': -0.457}"
406,On the G-SIFI buffer that you talked about earlier on the call. I just wanted to see – did you give us an update on what you think your surcharge is? I thought you were – before the most recent commentary it was like 2.5 %. Are you saying now it's 2%?,"{'neg': 0.0, 'neu': 0.943, 'pos': 0.057, 'compound': 0.4329}"
407,"On European competitors fading some of these businesses over time, how much does that matter to you when you think about the fact that the SIFI surcharge is in part a relative charge? So they fade naturally, you're going to grow as a percentage of total business. How much room is there to take on new business given the way the SIFI surcharge is structured?","{'neg': 0.0, 'neu': 0.977, 'pos': 0.023, 'compound': 0.1179}"
408,"You ended your prepared remarks saying the world changed in 2008, you cut costs, you implemented regulation and the implication is others are now catching up, implying a little more rational pricing, which You’ve said on prior calls. Can you just give us a description of the areas where you're seeing the biggest repricing or the areas that you're watching the most?Would you call this as an increase in your cost of goods sold that you're passing on to customers?And last follow up on this. Can you give a sense of magnitude? Are we talking basis point or tens of basis points or what?","{'neg': 0.02, 'neu': 0.931, 'pos': 0.049, 'compound': 0.4696}"
409,"On the litigation question, the litigation charge, presumably to add that much based on the Working Group issues that you referred to, there must have been an event, a point in y our discussions with them that began to give you a sense for a figure. And I was just wondering if that's a correct assumption?And also does y our view of kind of the y our – where y our litigation reserve stands now relative to what you will ultimately need, is that affected in any way by the New York Court of Appeals judgment on statute of limitations which came down during the quarter?","{'neg': 0.074, 'neu': 0.926, 'pos': 0.0, 'compound': -0.6553}"
410,"That 1 % that you gave in terms of the G-SIB buffer, which I think what you were saying was that is y our working assumption as to how much would go into the CCAR, sort of the increase, the stress minimum in CCAR. Is that right? So you're thinking that 1 % out of y our 2.5 % G-SIB buffer is how much you think is likely to get added to the stress minimum in CCAR?","{'neg': 0.081, 'neu': 0.892, 'pos': 0.027, 'compound': -0.6063}"
411,On the SLR. You made a lot of progress on your SLR in the quarter relative to where your core equity tier 1 ratios moved. So you are now 70 basis points ahead of the minimum. You increased 40 basis points in the quarter. Can you give a sense of some of the things that you did presumably to the denominator to continue to tighten up there?,"{'neg': 0.0, 'neu': 0.927, 'pos': 0.073, 'compound': 0.5994}"
412,"On equities in China, we've had a big selloff and most of you and your peers have been talking about equities being driven by strength in Asia. Have you seen any change in the environment and activity levels given the big selloff, or has that just helped – the volatility helped? Just trying to think through how that should be thought of going forward in terms of the equity franchise.","{'neg': 0.0, 'neu': 0.954, 'pos': 0.046, 'compound': 0.4939}"
413,"On the lending side, historically, you guys have shied away from retail risk, right, with regulatory and higher legal risk. This seems to be a bit of a departure from that historical viewpoint. So could you maybe just walk us through your – clearly there's an opportunity to make money, but the question is how you view the potentially higher risk in a retail lending format?","{'neg': 0.086, 'neu': 0.839, 'pos': 0.075, 'compound': -0.1901}"
